<?xml version="1.0" encoding="UTF-8"?>

<!--
file      : \code\src\platform\modules\sca\deploy_policy.xsd
install   : \install\conf\deploy_policy.xsd
author    : ZhongWei
created   : 2012/10/26 13:30
-->
<xsd:schema xmlns:xsd="http://www.w3.org/2001/XMLSchema"
            xmlns:svcmgr="http://www.td-tech.com/ubp/platform/svcmgr/xml"
            targetNamespace="http://www.td-tech.com/ubp/platform/svcmgr/xml">

  <xsd:complexType name="CoreInfo">
    <xsd:attribute name="core_count" type="xsd:string" use="required"/>
    <xsd:attribute name="value" type="xsd:string" use="required"/>
  </xsd:complexType>

  <xsd:complexType name="Service">
  	<xsd:sequence>
      <xsd:element name="CoreInfo" type="svcmgr:CoreInfo" maxOccurs="unbounded" minOccurs="0"/>
    </xsd:sequence>
    <xsd:attribute name="name" type="xsd:string" use="required"/>
  </xsd:complexType>  
  
  <xsd:complexType name="ServiceMode">
  	<xsd:sequence>
      <xsd:element name="Service" type="svcmgr:Service" maxOccurs="unbounded" minOccurs="0"/>
    </xsd:sequence>
    <xsd:attribute name="name" type="xsd:string" use="required"/>    
  </xsd:complexType>              

  <xsd:complexType name="ServiceModeInfo">
    <xsd:sequence>
      <xsd:element name="ServiceMode" type="svcmgr:ServiceMode" maxOccurs="unbounded"/>
    </xsd:sequence>    
  </xsd:complexType>            
  
  <xsd:complexType name="ServiceTypeA">
    <xsd:attribute name="type" type="xsd:string" use="required"/>
    <xsd:attribute name="defaultname" type="xsd:string" use="required"/>
    <xsd:attribute name="pubport" type="xsd:integer" use="required"/>
    <xsd:attribute name="dealport" type="xsd:integer" use="required"/>
    <xsd:attribute name="ip_type" type="xsd:integer" use="required"/>
  </xsd:complexType> 

  <xsd:complexType name="ServiceTypeInfo">
    <xsd:sequence>
      <xsd:element name="ServiceTypeA" type="svcmgr:ServiceTypeA" maxOccurs="unbounded"/>
    </xsd:sequence>
    <xsd:attribute name="port_offset" type="xsd:integer" use="required"/>
  </xsd:complexType>  

  <xsd:complexType name="HostCfg">
    <xsd:attribute name="name" type="xsd:string" use="required"/>
    <xsd:attribute name="value" type="xsd:string" use="required"/>
  </xsd:complexType>
    
  <xsd:complexType name="HostInfo">
    <xsd:sequence>
      <xsd:element name="HostCfg" type="svcmgr:HostCfg" maxOccurs="unbounded"/>
    </xsd:sequence>
    <xsd:attribute name="DBInit" type="xsd:boolean" />    
  </xsd:complexType>
  
  <xsd:complexType name="ServicePolicy">
  	   <xsd:sequence>
          <xsd:element name="HostInfo" type="svcmgr:HostInfo" />
          <xsd:element name="ServiceTypeInfo" type="svcmgr:ServiceTypeInfo" />
          <xsd:element name="ServiceModeInfo" type="svcmgr:ServiceModeInfo" />
       </xsd:sequence>
  </xsd:complexType>
  
  <xsd:element name="ServicePolicy" type="svcmgr:ServicePolicy"/>
</xsd:schema>

